{
  "meta": {
    "title": "Greene Family Heritage",
    "subtitle": "Tracing the Greene lineage from Portarlington to Dublin and beyond",
    "lastUpdated": "2026-06-06",
    "researcher": "Mark Garrigan",
    "changelog": [
      {
        "date": "2026-06-06",
        "summary": "Data integrity corrections, event provenance fields, privacy review worksheet, and JSON Schema added."
      },
      {
        "date": "2026-06-06",
        "summary": "2026-06-06: Phase 12 — Ita Greene marriage research + caregiving context corrections (per Mark's family contribution)"
      }
    ]
  },
  "people": [
    {
      "id": "thos-green-ballyburly",
      "name": "Thos Green",
      "born": {
        "year": "c.1800",
        "place": "Ballyburly, King's County (Offaly)"
      },
      "died": null,
      "occupation": "Landholder",
      "religion": null,
      "notes": "Earliest known ancestor. Appears in Tithe Applotment Books for Ballyburly parish, King's County, 1830s. Approximately 8km north of Portarlington.",
      "confidence": "low",
      "sources": [
        "Tithe Applotment Books, Ballyburly parish, King's County, 1830-36"
      ]
    },
    {
      "id": "joseph-greene",
      "name": "Joseph Greene",
      "born": {
        "year": "c.1840",
        "place": "Portarlington, King's County (Offaly)"
      },
      "died": null,
      "occupation": null,
      "religion": "Roman Catholic",
      "notes": "Confirmed father of Mary Bridget Greene (b.1874, Portarlington). Married Elizabeth Foran. May be connected to Lucy Greene (widow in Kilmalogue, 1901 census). NOTE (April 2026): an earlier hypothesis that Joseph was also Thomas Christopher Greene's father has been SUPERSEDED — the 1922 civil marriage register for Thomas × Bridget Clarke names Thomas's father as WILLIAM Greene, not Joseph. Joseph and William may yet prove to be related (e.g. brothers, both from Portarlington), but on present evidence Joseph is the confirmed father of Mary Bridget only.",
      "confidence": "medium",
      "sources": [
        "Ancestry record for Mary Bridget Greene (b.1874, d.1966, Queens NY)",
        "IrishGenealogy.ie civil marriage register cima-1271568 (1922) — names Thomas Greene's father as WILLIAM Greene, NOT Joseph; supersedes the earlier inference of Thomas as Joseph's son"
      ]
    },
    {
      "id": "elizabeth-foran",
      "name": "Elizabeth Foran",
      "born": {
        "year": "c.1845",
        "place": "Unknown, Ireland"
      },
      "died": null,
      "occupation": null,
      "religion": "Roman Catholic",
      "notes": "Wife of Joseph Greene. Mother of Mary Bridget Greene (b.1874, Portarlington). Maiden name Foran.",
      "confidence": "medium",
      "sources": [
        "Ancestry record for Mary Bridget Greene"
      ]
    },
    {
      "id": "lucy-greene",
      "name": "Lucy Greene",
      "born": {
        "year": "c.1841",
        "place": "King's County (Offaly)"
      },
      "died": {
        "year": "c.1901-1910",
        "place": "Portarlington"
      },
      "occupation": "Farmer",
      "religion": "Roman Catholic",
      "notes": "Widow by 1901, living in Kilmalogue, Portarlington North, King's Co. Possibly Joseph Greene's widow or a relative. Had daughter Lizzie who married Christopher Gannon. Absent from 1911 census (likely deceased).",
      "confidence": "medium",
      "sources": [
        "1901 Census: Kilmalogue, Portarlington North, King's Co., House 16"
      ]
    },
    {
      "id": "william-greene-thomas-father",
      "name": "William Greene",
      "born": {
        "year": "c.1840s",
        "place": "Portarlington area, Queen's/King's County (presumed)"
      },
      "died": null,
      "occupation": "Traveller (commercial traveller, per 1922 marriage register)",
      "religion": "Roman Catholic (presumed)",
      "notes": "Father of Thomas Christopher Greene. CONFIRMED (April 2026) from the 1922 civil marriage register (Dundrum, Rathdown RD, record cima-1271568) which names Thomas's father as \"William Greene, Traveller\". \"Traveller\" in this context almost certainly means commercial traveller (travelling salesman) rather than a member of the Irish Traveller community — a respectable late-Victorian / Edwardian occupation that involved going from town to town selling goods on commission. CANDIDATE IDENTITIES (not yet narrowed): two William Greenes appear in our prior Portarlington research and either could be him: (1) WILLIAM GREENE OF IMACRANNAGH — a farmer in the immediate vicinity of Portarlington, recorded with \"his large family\"; this is a strong geographical and generational fit for Thomas's father (Thomas b.c.1870 Portarlington), and a man could plausibly be a farmer in mid-life and a commercial traveller in later years; (2) WILLIAM GREENE OF SHANDERRY — listed as a labourer with the census note \"husband working in Dublin\", which is intriguing given Thomas's adult life as a Dublin warehouseman/porter. Civil records (a marriage record for William Greene to a yet-unknown wife, baptismal records of Thomas and any siblings in Portarlington Catholic parish registers, William's death certificate) are needed to settle the identity. NOTE: the earlier hypothesis that Joseph Greene (confirmed father of Mary Bridget Greene b.1874 Portarlington) was also Thomas's father is SUPERSEDED by this 1922 marriage record evidence. Joseph and William may yet prove related (siblings, cousins) — both being in Portarlington at the same time — but they are evidently distinct men.",
      "confidence": "high",
      "sources": [
        "IrishGenealogy.ie civil marriage register, Dundrum (Rathdown RD), 20 June 1922 — Thomas Greene (Widower, Warehouseman, of [Dublin]) × Bridget Clarke (Spinster, Housekeeper, of Drummartin House, Dundrum). Father of Thomas: WILLIAM GREENE (Traveller). Father of Bridget: PATRICK CLARKE (Farmer). Witnesses: Patrick Kennedy & Annie O'Malley. Officiant: Richard Duggan, P.P. Holy Cross, Dundrum. Record id cima-1271568. https://www.irishgenealogy.ie/view?record_id=cima-1271568",
        "Prior research: William Greene of Imacrannagh, Portarlington area (farmer, with a large family) — see portarlington.html",
        "Prior research: William Greene of Shanderry, Co. Laois (labourer; census note \"husband working in Dublin\") — see portarlington.html"
      ],
      "displayDisambiguation": "William Greene (Thomas's father, c.1840s-?)"
    },
    {
      "id": "thomas-greene",
      "name": "Thomas Christopher Greene",
      "born": {
        "year": "c. July 1870",
        "place": "Portarlington, Queen's County (Laois)"
      },
      "died": {
        "year": "1951",
        "place": "38 Goldenbridge Ave, Inchicore, Dublin",
        "date": "6 December 1951"
      },
      "occupation": "Shop Porter (1901), Gentleman's Club Steward (1911), Shop Porter — Switzers & Co. Drapers (1926), Warehouse Porter (1951)",
      "religion": "Roman Catholic",
      "notes": "Central figure of this research. Full name Thomas Christopher Greene (discovered from Ancestry marriage index). Born c. July 1870 in Portarlington (age 55y 9m in the April 1926 Census; age 81 at death in December 1951). Moved to Dublin by 1899. Lied about his age to enlist in the British Army at around age 14 (~1884) — likely the Prince of Wales's Leinster Regiment (Royal Canadians), headquartered at Birr Barracks, ~25 miles from Portarlington. Underage enlistment was common in the late Victorian army. May have served during the Boer War (1899-1902). Married twice: first to Elizabeth (d. c.1912-1925), then to Bridget Clarke. Marriage registered Dublin South, 1899, Vol 2, Page 593. In 1926, living at York Street, Dublin, working as Shop Porter at Switzers & Co. Drapers — the famous Grafton Street department store founded in 1838, one of Dublin's most prestigious retail institutions (later became Brown Thomas in 1995). Thomas would have walked the 10 minutes from York Street to Grafton Street each morning. His stepson Patrick (age 23, from first marriage) was also living in the household. Family moved to 38 Goldenbridge Avenue, Inchicore in the early-to-mid 1930s — part of Dublin Corporation's ambitious social housing programme replacing inner-city tenements with purpose-built suburban homes. Died 6 December 1951 at 38 Goldenbridge Avenue, age 81. Cause of death: carcinoma of stomach, cachexia, cardiac failure. Death registered by his son John Greene. Still listed as 'Warehouse Porter' at death — a working man to the end. FATHER CONFIRMED (April 2026, 1922 marriage register): Thomas's father is WILLIAM GREENE, occupation \"Traveller\" (almost certainly commercial traveller / travelling salesman). The 1922 marriage record names this directly. This corrects an earlier speculative parentage of Joseph Greene & Elizabeth Foran (which was based only on Joseph being the confirmed father of Mary Bridget Greene b.1874 in the same town); Joseph and William may yet prove related (siblings or cousins), but the direct documentary evidence names William. There are TWO William Greenes in our prior Portarlington research who could be this man: William Greene of Imacrannagh (farmer, with a \"large family\" — geographically and generationally a strong match for Thomas's father) and William Greene of Shanderry (labourer; census note \"husband working in Dublin\" — also intriguing given Thomas's adult life in Dublin). Identity not yet narrowed between the two.",
      "confidence": "high",
      "sources": [
        "1901 Census: Ranelagh Avenue, Rathmines & Rathgar East, Dublin (ID 1293881)",
        "1911 Census: Clonliffe Avenue, Mountjoy, Dublin (ID 15408)",
        "1926 Census: York Street, Dublin — Thomas Greene, Head, age 55y 9m, Shop Porter, Switzers & Co. Drapers",
        "Death Certificate: Entry 486, 6 December 1951, registered Dublin South, Registrar M. Ryan",